{
  "export_id": "billing_export_123",
  "destination": "local-jsonl",
  "organization_id": "org_123",
  "project_id": "project_123",
  "environment_id": "env_123",
  "metric": "sync_egress_bytes",
  "occurred_at_from": "2026-05-17T00:00:00Z",
  "occurred_at_to": "2026-05-18T00:00:00Z",
  "limit": 1000
}
